amir@mint:~$ date && sudo tcpdump -n
Fri 22 Jul 2022 11:09:47 AM BST
tcpdump: verbose output suppressed, use -v or -vv for full protocol decode
listening on wlp2s0, link-type EN10MB (Ethernet), capture size 262144 bytes
11:10:23.378782 IP 192.168.1.10 > 192.168.1.1: ICMP echo request, id 110, seq 1, length 64
11:10:24.386861 IP 192.168.1.10 > 192.168.1.1: ICMP echo request, id 110, seq 2, length 64
11:10:25.410896 IP 192.168.1.10 > 192.168.1.1: ICMP echo request, id 110, seq 3, length 64
11:10:26.434882 IP 192.168.1.10 > 192.168.1.1: ICMP echo request, id 110, seq 4, length 64
11:10:27.458889 IP 192.168.1.10 > 192.168.1.1: ICMP echo request, id 110, seq 5, length 64
11:10:28.450704 ARP, Request who-has 192.168.1.1 tell 192.168.1.10, length 28
11:10:28.453784 ARP, Reply 192.168.1.1 is-at c8:be:19:21:2b:b0, length 46
*** I have to many arp requests
11:11:32.846508 IP 192.168.1.10.42983 > 9.9.9.9.53: 3543+ A? google.com. (28)
11:11:32.846984 IP 192.168.1.10.33957 > 9.9.9.9.53: 13186+ AAAA? google.com. (28)
11:11:37.851927 IP 192.168.1.10.55225 > 1.1.1.1.53: 13186+ AAAA? google.com. (28)
11:11:37.852118 IP 192.168.1.10.42983 > 9.9.9.9.53: 3543+ A? google.com. (28)
11:11:38.082727 ARP, Request who-has 192.168.1.1 tell 192.168.1.10, length 28
11:11:38.084631 ARP, Reply 192.168.1.1 is-at c8:be:19:21:2b:b0, length 46
11:11:42.857267 IP 192.168.1.10.58920 > 9.9.9.9.53: 17176+ A? google.com.9.9.9.9. (36)
11:11:42.857604 IP 192.168.1.10.41785 > 1.1.1.1.53: 3543+ A? google.com. (28)
11:11:42.857852 IP 192.168.1.10.36378 > 9.9.9.9.53: 13186+ AAAA? google.com. (28)
11:11:42.858211 IP 192.168.1.10.43499 > 9.9.9.9.53: 16621+ AAAA? google.com.9.9.9.9. (36)
11:11:47.862546 IP 192.168.1.10.57755 > 1.1.1.1.53: 16621+ AAAA? google.com.9.9.9.9. (36)
11:11:47.862855 IP 192.168.1.10.58920 > 9.9.9.9.53: 17176+ A? google.com.9.9.9.9. (36)
11:11:47.863096 IP 192.168.1.10.51899 > 1.1.1.1.53: 13186+ AAAA? google.com. (28)
11:11:47.863331 IP 192.168.1.10.42262 > 9.9.9.9.53: 3543+ A? google.com. (28)
11:11:53.042690 IP 192.168.1.10.57755 > 1.1.1.1.53: 16621+ AAAA? google.com.9.9.9.9. (36)
11:11:53.042938 IP 192.168.1.10.42262 > 9.9.9.9.53: 3543+ A? google.com. (28)
11:11:53.043079 IP 192.168.1.10.51899 > 1.1.1.1.53: 13186+ AAAA? google.com. (28)
11:11:53.043201 IP 192.168.1.10.58920 > 9.9.9.9.53: 17176+ A? google.com.9.9.9.9. (36)
11:11:58.292655 IP 192.168.1.10.57755 > 1.1.1.1.53: 16621+ AAAA? google.com.9.9.9.9. (36)
11:11:58.292903 IP 192.168.1.10.58920 > 9.9.9.9.53: 17176+ A? google.com.9.9.9.9. (36)
11:11:58.293049 IP 192.168.1.10.51899 > 1.1.1.1.53: 13186+ AAAA? google.com. (28)
11:11:58.293173 IP 192.168.1.10.42262 > 9.9.9.9.53: 3543+ A? google.com. (28)
11:12:03.542712 IP 192.168.1.10.57755 > 1.1.1.1.53: 16621+ AAAA? google.com.9.9.9.9. (36)
11:12:03.543000 IP 192.168.1.10.42262 > 9.9.9.9.53: 3543+ A? google.com. (28)
11:12:03.543139 IP 192.168.1.10.51899 > 1.1.1.1.53: 13186+ AAAA? google.com. (28)
11:12:03.543264 IP 192.168.1.10.58920 > 9.9.9.9.53: 17176+ A? google.com.9.9.9.9. (36)
11:12:08.546724 ARP, Request who-has 192.168.1.1 tell 192.168.1.10, length 28
11:12:08.548683 ARP, Reply 192.168.1.1 is-at c8:be:19:21:2b:b0, length 46
11:12:08.792658 IP 192.168.1.10.57755 > 1.1.1.1.53: 16621+ AAAA? google.com.9.9.9.9. (36)
11:12:08.792901 IP 192.168.1.10.58920 > 9.9.9.9.53: 17176+ A? google.com.9.9.9.9. (36)
11:12:08.793045 IP 192.168.1.10.51899 > 1.1.1.1.53: 13186+ AAAA? google.com. (28)
11:12:08.793158 IP 192.168.1.10.42262 > 9.9.9.9.53: 3543+ A? google.com. (28)
*****
11:12:08.823684 IP 1.1.1.1.53 > 192.168.1.10.51899: 13186 1/0/0 AAAA 2001:4860:4802:32::78 (56)
11:12:08.824486 IP 9.9.9.9.53 > 192.168.1.10.42262: 3543 1/0/0 A 216.239.38.120 (44)
11:12:08.892220 IP 1.1.1.1.53 > 192.168.1.10.57755: 16621 NXDomain* 0/1/0 (111)
11:12:08.916931 IP 9.9.9.9.53 > 192.168.1.10.58920: 17176 NXDomain 0/1/0 (111)
***** after getting these packetes I can ping router
*** pinging router
11:13:06.538147 IP 192.168.1.10 > 192.168.1.1: ICMP echo request, id 111, seq 1, length 64
11:13:06.539099 IP 192.168.1.1 > 192.168.1.10: ICMP echo reply, id 111, seq 1, length 64
11:13:07.539566 IP 192.168.1.10 > 192.168.1.1: ICMP echo request, id 111, seq 2, length 64
11:13:07.540473 IP 192.168.1.1 > 192.168.1.10: ICMP echo reply, id 111, seq 2, length 64
11:13:08.540826 IP 192.168.1.10 > 192.168.1.1: ICMP echo request, id 111, seq 3, length 64
11:13:08.541730 IP 192.168.1.1 > 192.168.1.10: ICMP echo reply, id 111, seq 3, length 64
11:13:11.778698 ARP, Request who-has 192.168.1.1 tell 192.168.1.10, length 28
11:13:11.780797 ARP, Reply 192.168.1.1 is-at c8:be:19:21:2b:b0, length 46
11:13:16.455727 IP 192.168.1.10.35424 > 9.9.9.9.53: 3849+ A? google.com. (28)
11:13:16.456052 IP 192.168.1.10.53051 > 9.9.9.9.53: 14193+ AAAA? google.com. (28)
11:13:16.498940 IP 9.9.9.9.53 > 192.168.1.10.53051: 14193 1/0/0 AAAA 2001:4860:4802:32::78 (56)
11:13:16.499027 IP 9.9.9.9.53 > 192.168.1.10.35424: 3849 1/0/0 A 216.239.38.120 (44)
11:13:16.499048 IP 9.9.9.9.53 > 192.168.1.10.35424: 3849 1/0/0 A 216.239.38.120 (44)
11:13:16.499069 IP 9.9.9.9.53 > 192.168.1.10.53051: 14193 1/0/0 AAAA 2001:4860:4802:32::78 (56)
11:13:16.500189 IP 192.168.1.10 > 216.239.38.120: ICMP echo request, id 112, seq 1, length 64
11:13:16.555325 IP 216.239.38.120 > 192.168.1.10: ICMP echo reply, id 112, seq 1, length 64
11:13:16.556211 IP 192.168.1.10.40661 > 9.9.9.9.53: 8973+ PTR? 120.38.239.216.in-addr.arpa. (45)
11:13:16.666040 IP 9.9.9.9.53 > 192.168.1.10.40661: 8973 1/0/0 PTR any-in-2678.1e100.net. (80)
11:13:17.501832 IP 192.168.1.10 > 216.239.38.120: ICMP echo request, id 112, seq 2, length 64
11:13:17.554903 IP 216.239.38.120 > 192.168.1.10: ICMP echo reply, id 112, seq 2, length 64
11:13:18.503265 IP 192.168.1.10 > 216.239.38.120: ICMP echo request, id 112, seq 3, length 64
